{
  "allocation_regions": [
    {
      "end": "0x00800000",
      "id": "expansion",
      "start": "0x00400000"
    }
  ],
  "allocations": [
    {
      "alignment": "0x10",
      "class": "data",
      "id": "metadata-block",
      "size": "0x90"
    },
    {
      "alignment": "0x4",
      "class": "data",
      "id": "public-fixture",
      "size": "0x26"
    },
    {
      "alignment": "0x2",
      "class": "thumb",
      "id": "thumb-fixture",
      "size": "0x4"
    }
  ],
  "assets": [
    {
      "allocation": "public-fixture",
      "id": "insert-public-fixture",
      "path": "data/build/fixtures/public-domain.txt",
      "sha256": "db0cc60e9a08f3250447210106243e4371ec73fe96ef43951d06a0cee0481271"
    }
  ],
  "expansion": {
    "fill": "0xff",
    "reservations": [
      {
        "end": "0x00610000",
        "id": "reserved-future",
        "start": "0x00600000"
      }
    ],
    "target_size": "0x00800000"
  },
  "hooks": [],
  "metadata": {
    "allocation": "metadata-block",
    "enabled": true,
    "id": "write-build-metadata",
    "project_version": "0.1.0"
  },
  "modules": [
    {
      "allocation": "thumb-fixture",
      "encoding": "hex",
      "entry_offset": "0x0",
      "id": "insert-thumb-fixture",
      "path": "data/build/fixtures/thumb-return.hex",
      "sha256": "a7ddd513d149ea16fdd4db3f82267f83087aeaddd06b5dde5468adb704205fc4",
      "thumb": true
    }
  ],
  "output": {
    "bps_name": "spirit-unbound.bps",
    "rom_name": "spirit-unbound.gba"
  },
  "patches": [],
  "profile_id": "infrastructure-smoke",
  "project": "Spirit Unbound",
  "relocations": [],
  "schema_version": 1,
  "smoke_test": {
    "enabled": true
  },
  "source_rom": {
    "sha256": "c4a568adc896bace0e25dbff4aa0c1802933c88e3f4a4e825075116c8c4173e5",
    "size": "0x00400000"
  },
  "tables": [
    {
      "id": "validate-beyblade-table",
      "kind": "beyblade",
      "mode": "validate-only"
    },
    {
      "category": "attack-rings",
      "id": "validate-components-attack-rings",
      "kind": "component_names",
      "mode": "validate-only"
    },
    {
      "category": "blade-bases",
      "id": "validate-components-blade-bases",
      "kind": "component_names",
      "mode": "validate-only"
    },
    {
      "category": "spin-gears",
      "id": "validate-components-spin-gears",
      "kind": "component_names",
      "mode": "validate-only"
    },
    {
      "category": "weight-disks",
      "id": "validate-components-weight-disks",
      "kind": "component_names",
      "mode": "validate-only"
    },
    {
      "id": "validate-event-action-words",
      "kind": "event_word_stream",
      "mode": "validate-only",
      "offset": "0x000a8368",
      "size": "0x10"
    },
    {
      "id": "validate-event-bindings",
      "kind": "event_bindings",
      "mode": "validate-only"
    },
    {
      "id": "validate-presentation-pairs",
      "kind": "presentation_pairs",
      "mode": "validate-only"
    }
  ],
  "texts": [],
  "validation": {
    "allow_invalid_header": false,
    "require_base_unchanged": true
  }
}
