{
  "schema_version": 1,
  "project": "Spirit Unbound",
  "profile_id": "task8-research",
  "source_rom": {
    "sha256": "c4a568adc896bace0e25dbff4aa0c1802933c88e3f4a4e825075116c8c4173e5",
    "size": "0x00400000"
  },
  "output": {
    "rom_name": "spirit-unbound-task8-research.gba",
    "bps_name": "spirit-unbound-task8-research.bps"
  },
  "expansion": {
    "target_size": "0x00800000",
    "fill": "0xff",
    "reservations": [
      {
        "id": "reserved-future",
        "start": "0x00600000",
        "end": "0x00610000"
      }
    ]
  },
  "allocation_regions": [
    {
      "id": "expansion",
      "start": "0x00400000",
      "end": "0x00800000"
    }
  ],
  "allocations": [
    {
      "id": "task8-native-hooks",
      "size": "0x400",
      "alignment": "0x4",
      "class": "thumb",
      "fixed_offset": "0x00400000"
    },
    {
      "id": "task8-research-metadata",
      "size": "0x90",
      "alignment": "0x10",
      "class": "data",
      "fixed_offset": "0x00400400"
    }
  ],
  "assets": [],
  "tables": [],
  "texts": [],
  "modules": [
    {
      "id": "insert-task8-native-hooks",
      "allocation": "task8-native-hooks",
      "path": "data/build/fixtures/task8-new-game-hook.hex",
      "sha256": "7e402f1c1c8c1e3754ea7247bb3a9957f555956d2fc760ba182930c65b4afa09",
      "encoding": "hex",
      "entry_offset": "0x0",
      "thumb": true
    }
  ],
  "patches": [
    {
      "id": "extend-runtime-root-for-custom-slot",
      "kind": "write_u32",
      "offset": "0x0004612c",
      "expected": "c8180000",
      "value": "0x00001908"
    }
  ],
  "relocations": [],
  "hooks": [
    {
      "id": "hook-new-game-descriptor-selection",
      "kind": "thumb_bl",
      "site": "0x000652fa",
      "expected": "01f049f8",
      "destination_allocation": "task8-native-hooks",
      "destination_offset": "0x0",
      "depends_on": [
        "insert-task8-native-hooks"
      ]
    },
    {
      "id": "hook-save-payload-custom-slot",
      "kind": "thumb_bl",
      "site": "0x00044e80",
      "expected": "00f08af9",
      "destination_allocation": "task8-native-hooks",
      "destination_offset": "0x18",
      "depends_on": [
        "insert-task8-native-hooks",
        "extend-runtime-root-for-custom-slot"
      ]
    },
    {
      "id": "hook-load-payload-custom-slot",
      "kind": "thumb_bl",
      "site": "0x00045092",
      "expected": "00f07dfa",
      "destination_allocation": "task8-native-hooks",
      "destination_offset": "0x48",
      "depends_on": [
        "insert-task8-native-hooks",
        "extend-runtime-root-for-custom-slot"
      ]
    }
  ],
  "metadata": {
    "enabled": true,
    "id": "write-task8-research-metadata",
    "allocation": "task8-research-metadata",
    "project_version": "0.8.3-research"
  },
  "validation": {
    "allow_invalid_header": false,
    "require_base_unchanged": false
  },
  "smoke_test": {
    "enabled": false
  },
  "extension_metadata": {
    "task": "8",
    "release_status": "research-only",
    "behavior": "Initialize, validate, seal, and persist one 64-byte SU8C state slot through the retail payload serializer and deserializer while preserving the confirmed New Game transition.",
    "custom_state_storage": "retail payload record padding",
    "custom_slot_runtime_offset": "0x18C8",
    "slot_integrity": "schema and field invariants plus state validation and CRC32",
    "native_eeprom_tail_enabled": false,
    "creator_enabled": false
  }
}
